{
  "$schema":"https://json-schema.org/draft/2020-12/schema","$id":"https://schemas.spot-learn.test/ruleset.v1.schema.json","type":"object","additionalProperties":false,
  "required":["rulesetVersion","targetScore","scoreFloor","time","score","lockMs","wordHuntSchedule","limits","hint","content","finalChallenge","tieBreak"],
  "$defs":{"positive":{"type":"integer","minimum":1}},
  "properties":{
    "rulesetVersion":{"const":"1.0.0"},"targetScore":{"$ref":"#/$defs/positive"},"scoreFloor":{"type":"integer","minimum":0},
    "time":{"type":"object","additionalProperties":false,"required":["assetLoadMs","countdownMs","playingMs","finalRushStartsAtMs","wordHuntMs","wordHuntRevealMs","meaningQuizMs","meaningSettlementCapMs","suddenDeathMs","reconnectForfeitMs"],"properties":{"assetLoadMs":{"$ref":"#/$defs/positive"},"countdownMs":{"$ref":"#/$defs/positive"},"playingMs":{"$ref":"#/$defs/positive"},"finalRushStartsAtMs":{"$ref":"#/$defs/positive"},"wordHuntMs":{"$ref":"#/$defs/positive"},"wordHuntRevealMs":{"$ref":"#/$defs/positive"},"meaningQuizMs":{"$ref":"#/$defs/positive"},"meaningSettlementCapMs":{"$ref":"#/$defs/positive"},"suddenDeathMs":{"$ref":"#/$defs/positive"},"reconnectForfeitMs":{"$ref":"#/$defs/positive"}}},
    "score":{"type":"object","additionalProperties":false,"required":["normalDifference","hardDifference","finalRushDifferenceMultiplier","normalWordHunt","specialWordHunt","finalWord","meaning","combo","wrongAnswer","finalRushWrongAnswer"],"properties":{"normalDifference":{"$ref":"#/$defs/positive"},"hardDifference":{"$ref":"#/$defs/positive"},"finalRushDifferenceMultiplier":{"const":2},"normalWordHunt":{"$ref":"#/$defs/positive"},"specialWordHunt":{"$ref":"#/$defs/positive"},"finalWord":{"$ref":"#/$defs/positive"},"meaning":{"$ref":"#/$defs/positive"},"combo":{"$ref":"#/$defs/positive"},"wrongAnswer":{"type":"integer","maximum":-1},"finalRushWrongAnswer":{"type":"integer","maximum":-1}}},
    "lockMs":{"type":"object","additionalProperties":false,"required":["wrongAnswer","finalRushWrongAnswer"],"properties":{"wrongAnswer":{"$ref":"#/$defs/positive"},"finalRushWrongAnswer":{"$ref":"#/$defs/positive"}}},
    "wordHuntSchedule":{"type":"array","minItems":3,"maxItems":3,"prefixItems":[{"type":"object","additionalProperties":false,"required":["kind","spawnWindowMs"],"properties":{"kind":{"const":"NORMAL"},"spawnWindowMs":{"type":"array","prefixItems":[{"type":"integer","minimum":0},{"type":"integer","minimum":1}],"items":false,"minItems":2,"maxItems":2}}},{"type":"object","additionalProperties":false,"required":["kind","spawnWindowMs"],"properties":{"kind":{"const":"NORMAL"},"spawnWindowMs":{"type":"array","prefixItems":[{"type":"integer","minimum":0},{"type":"integer","minimum":1}],"items":false,"minItems":2,"maxItems":2}}},{"type":"object","additionalProperties":false,"required":["kind","spawnAtMs"],"properties":{"kind":{"const":"SPECIAL"},"spawnAtMs":{"type":"integer","minimum":0}}}],"items":false},
    "limits":{"type":"object","additionalProperties":false,"required":["maxBoardTapsPerSecond"],"properties":{"maxBoardTapsPerSecond":{"$ref":"#/$defs/positive"}}},
    "hint":{"type":"object","additionalProperties":false,"required":["creditsPerWordHuntWin","charactersPerUse","revealOrder"],"properties":{"creditsPerWordHuntWin":{"const":1},"charactersPerUse":{"const":1},"revealOrder":{"const":"MATCH_RANDOM_SCHEDULE"}}},
    "content":{"type":"object","additionalProperties":false,"required":["minDifferences","maxDifferences","hardDifferenceNumerator","hardDifferenceDenominator","wordHunts"],"properties":{"minDifferences":{"const":5},"maxDifferences":{"const":20},"hardDifferenceNumerator":{"const":3},"hardDifferenceDenominator":{"const":10},"wordHunts":{"const":3}}},
    "finalChallenge":{"type":"object","additionalProperties":false,"required":["unlock","maxWrongAttempts","atomicScoring"],"properties":{"unlock":{"type":"object","additionalProperties":false,"required":["atMs","onDifferenceClaim","onWordHuntClaim"],"properties":{"atMs":{"type":"integer","minimum":0},"onDifferenceClaim":{"const":true},"onWordHuntClaim":{"const":true}}},"maxWrongAttempts":{"const":3},"atomicScoring":{"const":true}}},
    "tieBreak":{"type":"array","prefixItems":[{"const":"SCORE"},{"const":"FINAL_PACKAGE_CORRECT"},{"const":"HARD_DIFFERENCES"},{"const":"FEWER_FINAL_ANSWER_ERRORS"},{"const":"SUDDEN_DEATH"}],"items":false,"minItems":5,"maxItems":5,"uniqueItems":true}
  }
}
